{
  "schema_version": "1",
  "job_id": "analysis_01J8Z3Q6X4",
  "analysis_type": "historical_fire_impact",
  "question": "How did vegetation change around the Line Fire?",
  "area": {"type":"Polygon","coordinates":[[[-117.2,34.1],[-116.95,34.1],[-116.95,34.25],[-117.2,34.25],[-117.2,34.1]]]},
  "date_range": { "start": "2024-01-01", "end": "2026-09-01" },
  "requested_at": "2026-09-23T18:00:00Z"
}
